vocab_id,content
186,– Tiếng chim ngân nga buổi sáng.
187,Vầng dương đỏ rực lúc bình minh.
187,– Vầng dương tỏa nắng ấm áp.
188,Kim cương rất quý hiếm và đắt đỏ .                                                                                                                                - Chiếc nhẫn đó được làm bằng kim cương sáng lấp lánh.
189,Ánh sao lấp lánh trên trời.
189,– Dòng sông lấp lánh dưới nắng.
190,Nắng ban mai dịu nhẹ.                                                                                                                                                      - Ban mai gọi ngày mới.
191,Quê em có dòng sông hiền hoà.                                - Ánh mắt mẹ hiền hoà.
192,Sóng biển dập dờn ngoài khơi.
192,– Ánh đèn dập dờn trong đêm.
193,Chim chiền chiện hót trên cánh đồng.
193,– Tiếng chiền chiện vang giữa trời xanh.
194,Con chim chiền chiện kêu tích ri tích rích
195,Cô bé ngân nga câu hát quen  thuộc.                                                                                                                           - Chim hót ngân nga buổi sớm.
196,Cánh đồng lúa mênh mông.                                                                                                                                             - Sa mạc mênh mông cát trắng.
